urls,标题,标签,简介,封面图片,标题分数,标签分数,封面图片分数,简介分数
https://www.bilibili.com/video/BV1734y1C7Vr/,韩越联手，如何在英文世界消灭“中国”新年,故事档案馆 美国 历史 越南 韩国 新年 冬奥会 春节 lunar new year 打卡挑战 ,用英文拜年，以前有很多种表达方式，但现在逐渐固定成了Happy Lunar New Year。语言的多样性在政治正确面前不堪一击。你有没有想过，这可能是一场文化战争？,http://i0.hdslb.com/bfs/archive/6b6204def38db3ab9758ff67142d0aad2e343b3a.jpg,0.1350734836708713,0.04840481852390735,-1.125,
https://www.bilibili.com/video/BV11B4y1y7wR/,刚和总统握完手就被反对党罚到破产，美国梦如何成为美国人的噩梦,历史 美国 人物 学习 下沉年代 多多读书月 美国梦 好书 2022读书日 ,一键三连推荐给更多朋友！,http://i1.hdslb.com/bfs/archive/c964d042520a44863f4d82ded3c7603ebbfec7ed.jpg,0.11304078416613478,0.05629715757507138,-1.125,
https://www.bilibili.com/video/BV1U14y1u7pd/,王骁年度分享：我们习惯的世界要走了,故事档案馆 英国 欧盟 霸权 2022 能源危机 伊丽莎白二世 俄乌冲突 中美贸易战 百年未有之大变局 ,一键三连推荐给更多朋友！,http://i2.hdslb.com/bfs/archive/acc594958297c0d21b500695453088727a509b53.jpg,0.07397129483465995,0.0,-1.0625,
https://www.bilibili.com/video/BV1sp4y1t7Hz/,埃及人上辈子捡了什么宝，能碰上敢这么盘国家的鬼才？,知识分享官 历史 奇闻 埃及 王骁 骁话一下 ,新号看到的人比较少，如果觉得还不错，三连让更多志趣相投的朋友看到吧！,http://i0.hdslb.com/bfs/archive/83d817df0b6449dbbc6dddfd4a6b45725efc4528.jpg,0.0,0.3563004293331381,-0.6875,
https://www.bilibili.com/video/BV1X64y1Q7sW/,1/4人艾滋，裸选后宫，百姓为奴，活化石国家终于乱了！【斯威士兰】,知识分享官 人物 非洲 英国 历史 奇闻 文化 王骁 南非 斯威士兰 ,点赞投币转发给志同道合的朋友，我们一起变得更强！,http://i2.hdslb.com/bfs/archive/69d38befda05819e249c6df58a37c46712d4eda5.jpg,0.0,0.3360969272762575,-1.0,
https://www.bilibili.com/video/BV14M4y1K7EN/,美国吃亏，苏联流泪，军阀让位，伊朗如何以神之名搞现代化？,人文 知识分享官 知识 历史 伊朗 石油 王骁 西亚 中东 天降猛男 ,欢迎有收获的朋友们，有币的捧个币场，没币的点点赞，帮我也变得更强！,http://i2.hdslb.com/bfs/archive/6456fe87437f680e8f10087e4698bac7ebc1b237.jpg,0.05355095314996731,0.3360969272762575,-0.4375,
https://www.bilibili.com/video/BV1h54y157FM/,抗战为什么8年改14年？无名英雄在怎样的绝望中，死命攒出新中国的星星之火？,五月哔刷片·五月新片 电影 历史 东北 中国 抗日 王骁 抗日战争 悬崖之上 影娱哔哔官 ,希望大家可以帮我点亮大拇指小金币小星星，让更多的人看到这段历史。,http://i1.hdslb.com/bfs/archive/f3bddeaad3caee8149d64e1bb5428c26934ce94e.jpg,0.0,0.10658510262542638,-0.875,0.05355095314996731
https://www.bilibili.com/video/BV15b4y1Z7r6/,【人文社科①】b站最全志愿填报专业选择指南！61专业100嘉宾！第1期：历史国际关系政治社会心理英文小语种中文 文科专业高考志愿填报,科普 人文 2021高考季 英语 伢伢 历史 大学 毕业季 王骁 lks ,本期专业：历史、政治（含国际关系）、社会、心理、英文、小语种、中文 感谢各位嘉宾：小王Albert（王骁待产中）、小徐、多罗西123、-LKs-、伢伢gagako、溪子心理、是毛布斯呀、James、二锐、小蝶今天吃饱了、魏春露 下期预告：新闻传播、广告、法律、侦查、哲学、马克思主义、教育,http://i2.hdslb.com/bfs/archive/ecfd5bcf5eaaa57e8ea97f7be92b15b5f5cf96eb.jpg,0.0,0.17828145388467143,-0.1875,0.048788961505064905
https://www.bilibili.com/video/BV1aP4y177qM/,拿一手烂牌打成非洲经济第一，天降非酋如何带飞博茨瓦纳,人文 故事档案馆 历史 酋长 非洲 塞雷茨 博茨瓦纳 王骁 南非 打卡挑战 ,20220121，回来看的第二个国家，博茨瓦纳。 今天要让你开一局游戏，你成为了一个非洲南部国家的领导人，国家不临海，全国地形都是干燥的台地，70%的国土是沙漠，社会基层是部落，被英国殖民过，连个首都城市都没有。这个开局还有人愿意玩儿吗？但是真就有个猛男，把这个开局玩成了非洲经济最好。,http://i1.hdslb.com/bfs/archive/37910df94bf23692feadf7565633f7daff8d11e2.jpg,0.05355095314996731,0.25233420143369617,-0.9375,0.0424980328019522
https://www.bilibili.com/video/BV1XA411V7hm/,印度炸了，求求莫迪好好抗疫，别玩政治了,知识分享官 社会 历史 印度 奇闻 莫迪 疫情 ,期待你的一键三连~！祝大家身体快乐~,http://i1.hdslb.com/bfs/archive/4a83c496999861bc0036d79d0ee2450f5ecec47c.jpg,0.0,0.22150013430590973,0.25,
https://www.bilibili.com/video/BV1NA411V7me/,东南亚衰落怪文科生？大胆一点！怪大学生！,知识分享官 财经 历史 教育 大学 王骁 经济 东南亚 商业 ,新号看到的人比较少，欢迎关注+一键三连！ 每周六，小王陪你看世界~,http://i0.hdslb.com/bfs/archive/ff3dde31136b41032dbd19fd9dec49550bdfe42b.jpg,0.0,0.18976728433844914,0.0,
https://www.bilibili.com/video/BV1ph411h7wV/,天降猛女张桂梅，工人阶级先锋队，如何在和平年代做革命者,知识分享官 女性 人物 历史 建党百年 张桂梅 中国共产党成立100周年 基层教育 王骁 脱贫攻坚 ,希望大家可以帮我一键三连，让更多的朋友看到张桂梅的故事。,http://i1.hdslb.com/bfs/archive/7b2e5b5b63ee240447a6874e004178ee095b2bb7.jpg,0.05951439576030657,0.17828145388467143,-0.0625,
BV1Fz4y117pV,反了反了！赘婿总统噬主了！【奇葩小国12】,寒假学习挑战赛 人物 非洲 西班牙 社会 历史 总统 马西埃 石油 赤道几内亚 打卡挑战 ,赤道几内亚的故事，就是从一个物理上敲骨吸髓的疯子，到一个经济上敲骨吸髓的贪官的故事。,http://i0.hdslb.com/bfs/archive/c67c201e460b33cb702a6a429eb606eee83aa834.jpg,0.07397129483465995,0.16865689277472462,-0.875,
BV1bh411e7Mo,乍得为何成为美国的看门狗，还要自备狗粮,知识分享官 人文 历史 地图 美国 代比 卡扎菲 利比亚 乍得 皮卡战争 ,-,http://i2.hdslb.com/bfs/archive/f4018d54db2d6dd880262a1ceeb1802b7ede7ada.jpg,0.06804963087832473,0.25233420143369617,-0.75,
BV1V34y1v76s,法国又要选总统了，最大的挑战是什么？为什么选谁都没用？,法国 社会 知识 历史 法兰西 勒庞 法国大选 马克龙 法国福利 历史人文档案馆 ,一键三连，推荐给更多的朋友！一起变得更强！,http://i1.hdslb.com/bfs/archive/c31ae4401d69def9cfec8480f35e996ff29b010e.jpg,0.06804963087832473,0.1123427789154278,-1.0,
BV1wf4y1r7sr,因为一封信，他去非洲当了一把气氛组【奇葩小国09】,知识分享官 暴君 奇闻 法国 人文 非洲 历史 外交 中非 博卡萨 ,非洲独立史以来最残暴，最荒唐，也是最滑稽的统治者——中非皇帝，博卡萨。,http://i0.hdslb.com/bfs/archive/f0fc469c8839b5037dbceb52d366058d760511eb.jpg,0.0,0.43161341897075156,-0.6875,
BV1x64y1d7pS,中国帮忙抗疫惹一身骚，意大利为何总是“天降流氓”？,知识分享官 意大利 人文 罗马 历史 文艺复兴 奇闻 王骁 天主教 斗兽场 ,欢迎有收获的朋友们，有币的捧个币场，没币的点点赞，我们一起变得更强！,http://i2.hdslb.com/bfs/archive/4feaa149382b0dae6b343ab5d4627d4f36d49fb0.jpg,0.0,0.3360969272762575,-0.8125,
BV1vR4y1n7Ug,南非大乱经济崩溃，金砖国家怎么被黑人摔得稀碎？,知识分享官 人文 历史 非洲 人物 黑人 南非 经济 曼德拉 祖马 ,一键三连推荐给更多朋友~,http://i2.hdslb.com/bfs/archive/a8d0322455273964bb0036f765dc34d2d42bcc2f.jpg,0.0,0.25233420143369617,-0.4375,
BV1D44y1R7oC,丰田皮卡为什么在非洲是军火？【奇葩小国44】,奇闻 战争 奇葩 非洲 历史 世界史 卡扎菲 乍得 历史人文档案馆 社科人文分享官·第二期 ,本篇为奇葩小国之乍得（下）。  参考资料： 阿泽维多·马里奥1998年出版《暴力的根源：乍得战争史》 汤普森·弗吉尼亚1981年出版《乍得冲突》 《乍得内战研究》柴庆友 印第安纳大学出版社1988年《绿与黑：卡扎菲的非洲政策》 约翰·米德尔顿1997年出版《撒哈拉以南非洲百科全书》 内维尔·利2018年出版《技术：从伟大的丰田战争到现代特种部队的非标准战术车辆》 塞缪尔·迪卡罗1997年出版《乍得历史词典》,http://i2.hdslb.com/bfs/archive/c8be8397418fb5aa877b7620f9d5b601211aae80.jpg,0.0,0.2379441116128916,-1.4375,0.16288681126974644
BV1h54y157FM,抗战为什么8年改14年？无名英雄在怎样的绝望中，死命攒出新中国的星星之火？,五月哔刷片·五月新片 历史 东北 电影 中国 抗日 抗日战争 王骁 悬崖之上 影娱哔哔官 ,希望大家可以帮我点亮大拇指小金币小星星，让更多的人看到这段历史。,http://i1.hdslb.com/bfs/archive/f3bddeaad3caee8149d64e1bb5428c26934ce94e.jpg,0.0,0.10658510262542638,-0.875,0.05355095314996731
BV1wf4y1r7sr,因为一封信，他去非洲当了一把气氛组【奇葩小国09】,知识分享官 暴君 奇闻 法国 人文 非洲 历史 外交 中非 博卡萨 ,非洲独立史以来最残暴，最荒唐，也是最滑稽的统治者——中非皇帝，博卡萨。,http://i0.hdslb.com/bfs/archive/f0fc469c8839b5037dbceb52d366058d760511eb.jpg,0.0,0.43161341897075156,-0.6875,0.050656087645095244
BV1if4y147NZ,黄金配角身价千万，为什么吴孟达在香港无处落葬？,故事档案馆 香港 社会 中国 吴孟达 人文 王骁 墓地 骁话一下 打卡挑战 ,新号看到的人比较少，求关注+三连，我们一起变得更强！,http://i2.hdslb.com/bfs/archive/133f22050c7e53ac4f917e53a2b1996f764e7524.jpg,0.0,0.11234277891542778,0.0,
BV1NA411V7me,东南亚衰落怪文科生？大胆一点！怪大学生！,知识分享官 大学 财经 教育 历史 东南亚 经济 王骁 商业 ,新号看到的人比较少，欢迎关注+一键三连！ 每周六，小王陪你看世界~,http://i0.hdslb.com/bfs/archive/ff3dde31136b41032dbd19fd9dec49550bdfe42b.jpg,0.0,0.18976728433844914,0.0,
BV1ks4y1M7gu,都说中国发展的秘密藏在招商，南京是怎么做的？,南京 中国 秦淮河 夫子庙 钟山 投资 ,一键三连推荐给更多朋友！,http://i0.hdslb.com/bfs/archive/753eaf7fa037668f0c7ca79d5983c187c002b710.jpg,0.0,0.0,-0.1875,
BV1L24y1y7RG,云·游世界——乍得,自然 旅游 风景 美景 户外 必剪创作 ,https://www.youtube.com/watch?v=7dh3STiTswg 乍得共和国（英语：Republic of Chad），简称“乍得”（或译查德，阿拉伯语：تشاد‎，法语：Tchad），是非洲中部的一个内陆国家，北接利比亚，东邻苏丹，南与中非共和国接壤，西南与喀麦隆、尼日利亚为邻，西与尼日尔交界。首都及最大城市为恩贾梅纳，国土面积128.4万平方公里，人口1640万（2020年）。全国共有民族256个，全国划分为23个地区、95个省、365个市镇。,http://i2.hdslb.com/bfs/archive/2230d1f873cb7b1457e6b0d8036786ccb8eb2ac4.jpg,0.3554767779546839,0.0,-1.1875,
BV1fh411m74Q,【卢克说】乍得（上）：军人当总统会是如何？总统刚刚阵亡的非洲中部国家——乍得共和国,星海计划 非洲 总统 乍得 ,-,http://i0.hdslb.com/bfs/archive/f78f22e2968133ac5ddfeb5f5a9a9770fc91b9d2.jpg,0.260512477594733,0.1943143401685815,-0.6875,
BV1eY4y1W7Yc,乍得,影视剪影 剪辑 自制 原创 ,乍得,http://i2.hdslb.com/bfs/archive/7bba348599d47be04637de1bd09b884dc9489a9f.jpg,0.24395572500006343,0.0,-0.8125,
BV1Gh411k7oS,非洲乍得各地女性割礼的比例,知识分享官 原创 非洲 女性 乍得 ,-,http://i2.hdslb.com/bfs/archive/768e3cfa9bf9821f55ed4086e04142000a7e01b2.jpg,0.07397129483465995,0.2773962289762415,-1.125,
BV1Ss4y1D7pd,【铀矿王国】世界最不发达国家之一的非洲中部内陆国乍得首都——恩贾梅纳（N'Djamena）,非洲 法国 铀矿 乍得 恩贾梅纳 ,https://www.youtube.com/watch?v=IuvHMvHcR50&pp=ygUPTidEamFtZW5hIGRyb25l,http://i1.hdslb.com/bfs/archive/af989597727def730c680f268c92212519ba292e.jpg,0.10778626961492307,0.2773962289762415,-1.25,
BV1N64y1Q71b,我为祖国献石油！大庆石油与“铁人”王进喜！,人文 工业 中国 历史 石油 ,《我们走在大路上》纪录片,http://i2.hdslb.com/bfs/archive/410399fd49e06b65112764469fc6f83ae9a05c68.jpg,0.0,0.2773962289762415,-1.0625,
BV1eY4y1W7Yc,乍得,影视剪影 剪辑 自制 原创 ,乍得,http://i2.hdslb.com/bfs/archive/7bba348599d47be04637de1bd09b884dc9489a9f.jpg,0.24395572500006343,0.0,-0.8125,0.21951095080860833
BV1D44y1R7oC,丰田皮卡为什么在非洲是军火？【奇葩小国44】,非洲 战争 奇闻 奇葩 历史 卡扎菲 世界史 乍得 历史人文档案馆 社科人文分享官·第二期 ,本篇为奇葩小国之乍得（下）。  参考资料： 阿泽维多·马里奥1998年出版《暴力的根源：乍得战争史》 汤普森·弗吉尼亚1981年出版《乍得冲突》 《乍得内战研究》柴庆友 印第安纳大学出版社1988年《绿与黑：卡扎菲的非洲政策》 约翰·米德尔顿1997年出版《撒哈拉以南非洲百科全书》 内维尔·利2018年出版《技术：从伟大的丰田战争到现代特种部队的非标准战术车辆》 塞缪尔·迪卡罗1997年出版《乍得历史词典》,http://i2.hdslb.com/bfs/archive/c8be8397418fb5aa877b7620f9d5b601211aae80.jpg,0.0,0.2379441116128916,-1.4375,0.16288681126974644
BV1sP4y197HU,卡扎菲的野望在哪里？【奇葩小国43】,历史 人文 知识 战争 人物 世界史 卡扎菲 乍得 历史人文档案馆 社科人文分享官·第二期 ,本篇为奇葩小国之乍得（上）。  参考资料： 阿泽维多·马里奥1998年出版《暴力的根源：乍得战争史》 汤普森·弗吉尼亚1981年出版《乍得冲突》 《乍得内战研究》柴庆友 印第安纳大学出版社1988年《绿与黑：卡扎菲的非洲政策》 约翰·米德尔顿1997年出版《撒哈拉以南非洲百科全书》 内维尔·利2018年出版《技术：从伟大的丰田战争到现代特种部队的非标准战术车辆》 塞缪尔·迪卡罗1997年出版《乍得历史词典》,http://i1.hdslb.com/bfs/archive/473e045c0dcd13dbf4c217bf87ecea6d6b71dbad.jpg,0.0,0.16865689277472462,-0.8125,0.16288681126974644
BV1Z8411v7tP,【将军令】虽然曾经那个意气风发得少年再也回不来了，但是陈则明大将军仍然在坚持他的内心，一腔忠勇，保卫家国，而这次为了和谈却战死沙场！,UP！新学期 少年 大将军 九月创作打卡 家国 将军令 陈则铭 必剪创作 ,渣定你要明白:陈将军忠于的从来都不是你个人，而是忠于这个国家！曾经那个意气风发的少年是崇拜你，而非爱慕于你，你却因为自己的私心私情毁了他一生！,http://i1.hdslb.com/bfs/archive/8778c1d065cf70614f88e8b4ff3a8662b8b7229e.jpg,0.037429037728181624,0.0,-0.125,
BV1jP411p7Ft,【CF】玉足兰姐战死沙场 并最终沉入海底（CF海滩兰r）,玉足 穿越火线 兰-海滩派对 泳装兰 CF 凉鞋 ryon 死亡姿势 必剪创作 CF15周年无所不燃 穿越火线15周年激励计划 ,CF海滩兰新一期，包括水下姿势，最后有彩蛋，放心享用吧！,http://i2.hdslb.com/bfs/archive/d5612f22d61391c30a012582b4595b82dfcfd1f7.jpg,0.05629715757507138,0.0,-0.1875,
BV1364y1U7qM,乍得总统战死沙场传开，多地爆发示威数人伤亡，中国使馆正式发声,总统 冲突 乍得 ,乍得总统战死沙场传开，多地爆发示威数人伤亡，中国使馆正式发声,http://i0.hdslb.com/bfs/archive/0fdba0c1c90058a9718e581ed37b3de4dd69decf.jpg,0.17952265829918895,0.10371551133313005,-0.1875,
BV1i64y1m7X6,30年乍得总统战死沙场？《非 洲 保 安》如何把产油国玩成世界倒数？,人文 知识分享官 历史 丰田 法国 非洲 奇闻 王骁 石油 乍得 ,欢迎有收获的朋友们，有币的捧个币场，没币的点点赞，帮我也变得更强！,,,,,
